{
 "schema_id": "M4Compression.v1",
 "trial_id": "m4-01-ordinal2x2-2026-09-11",
 "corpus": {
  "id": "ORDINAL_2X2_COMPLETE",
  "version": "v1",
  "sha256": "a2c4d3bffcf0adb3912744defdc727f021e7c5f3456167cc5c1cc947394e6806",
  "count": 78,
  "sampling_rule": "none \u2014 complete enumeration of the space, then one representative per orbit",
  "citation": "Rapoport & Guyer (1966); Robinson & Goforth (2005) \u2014 external provenance of the space",
  "note": "complete enumeration; the \u00a75 kill 'corpus selected using desired placements' cannot fire on a complete space"
 },
 "native_encoder": {
  "id": "ordinal-rank-baseline",
  "fit_without_emergentist_coordinates": true,
  "description": "the eight ordinal payoff ranks, the space's own standard representation"
 },
 "target": {
  "kind": "held_out_classification",
  "metric": "macro_f1",
  "primary": "pure_ne_count",
  "also_run": [
   "nash_pareto",
   "is_dilemma",
   "row_dominant"
  ],
  "ground_truth": "computed from payoff ranks by definition; no model, no interpretation"
 },
 "code_length": {
  "unit": "bits",
  "includes_dictionary": true,
  "missing_placement_costed": true,
  "components": "data + dictionary + model + missing-placement symbols"
 },
 "parameter_count": 4,
 "distortion_metric": {
  "name": "macro_f1_shortfall_vs_floor",
  "maximum": 0.1
 },
 "performance_floor": {
  "metric": "macro_f1",
  "minimum": 0.8
 },
 "splits": {
  "scheme": "deterministic stratified 6-fold over the complete space",
  "development": "folds 1-4 (feature selection for ONE_AXIS and LEARNED_NO_PLACEMENT touched only these)",
  "validation": "fold 5",
  "held_out": "fold 6",
  "note": "reported scores are the mean across all 6 rotations; per-fold min and max are in m4_run_result.json"
 },
 "comparators": [
  {
   "kind": "NATIVE",
   "id": "ordinal-rank-baseline",
   "macro_f1": 0.7195,
   "bits": 1065.0
  },
  {
   "kind": "ONE_AXIS",
   "id": "best-one-axis-on-dev(dominance)",
   "macro_f1": 0.5778,
   "bits": 134.6
  },
  {
   "kind": "ALTERNATE_TWO_AXIS",
   "id": "dominance-x-conflict-sign",
   "macro_f1": 0.9407,
   "bits": 272.6
  },
  {
   "kind": "ADDED_AXIS",
   "id": "four-axis-plus-dominance",
   "macro_f1": 0.8963,
   "bits": 667.1
  },
  {
   "kind": "LEARNED_NO_PLACEMENT",
   "id": "two-features-selected-on-dev",
   "macro_f1": 0.5778,
   "bits": 218.6
  }
 ],
 "resource_parity": {
  "same_training_rows": true,
  "same_target_access": true,
  "same_parameter_budget": true,
  "same_compute_budget": true,
  "learner": "identical depth-3, 8-leaf decision tree for every representation"
 },
 "maximality_scope": "FROZEN_COMPARATOR_CLASS_ONLY",
 "global_game_theory_exhausted": false,
 "result_state": "KILLED",
 "kill": "KILLED on this corpus and comparator class. The four-axis encoding scored macro_f1 0.2817 on the primary target against a majority baseline of 0.2815 \u2014 no signal \u2014 and lost to all four required comparators. Three \u00a75 kills fired: (1) a generic representation matched or beat it at lower code length (ONE_AXIS 0.5778 at 135 bits vs 0.2817 at 542; on is_dilemma ONE_AXIS matched it exactly at 89 bits vs 536); (2) the ADDED_AXIS comparator produced a large held-out gain (+0.61 macro_f1 on the primary target from one added axis); (3) it fell below the frozen 0.8 floor on every target. On nash_pareto \u2014 the ego/collective question, its own home turf \u2014 it scored 0.4464, BELOW the 0.4545 majority baseline. The missing-placement penalty is not the cause: M4_TWO_LIVE_AXES, carrying no missing-placement cost, scored identically on all four targets.",
 "survivor": "Per \u00a75 the chart survives as a visualization, interpretive vocabulary and hypothesis generator; it does not survive as a measured optimal code. SCOPE OF THIS KILL, stated narrowly: one corpus (one-shot strictly ordinal 2x2 games, complete, n=78), four targets, one learner, one comparator class. Axes 3 and 4 (physical/represented power, short/long horizon) have NO REFERENT in a one-shot ordinal game and were recorded as costed missing placements rather than assigned by an undisclosed rule. This result therefore does not test the four-axis encoding on corpora where those axes denote \u2014 repeated games, policies, corpora with information structure or a horizon. Such a corpus is the obvious next run and the harness accepts one unchanged."
}